{
  "$schema": "metadata_supplement.schema.json",
  "schema_version": 1,
  "supplement_id": "granados2018-source-questions-01",
  "status": "metadata_review_only_original_ineligibility_preserved",
  "original_protocol_sha256": "e901d3985b5577d6f846229e1178062414e3220a7307b6d8ee40b0d01e9dffde",
  "original_candidate_id": "granados2018_sfp1_carbon_localization",
  "original_candidate_status": "ineligible_under_current_protocol",
  "parent_design_review_path": "data/native_law_v2/protocol_review.json",
  "response_export_authorized": false,
  "model_training_performed": false,
  "thresholds_or_protocol_criteria_changed": false,
  "new_estimand_selected_or_authorized": false,
  "custody_note": "All response values remain custodial. The follow-up specifically authorized deterministic identity checks: source normalizer means/SDs were computed privately for that purpose only. No constants, response summaries, distances, curve similarities, model scores or response projections were released. No original protocol outcome was scored.",
  "questions": [
    {
      "question_id": "prefix_normalization_and_conditional_estimand",
      "resolution": "Core prefix normalizer verified; a legitimate prefix-conditional estimand is possible in principle but the full published preprocessing is not certified prefix-only.",
      "facts": [
        {
          "id": "primary_text_definition",
          "statement": "SI 3.1 states x_i(t) -> (x_i(t)-mu)/sigma, with mu and sigma obtained from all cells in one microfluidic experiment across 20 pre-stress time points described as 50 minutes. This is not normalization by a future peak or a whole-trace extremum.",
          "evidence": ["provenance/supplement_methods_excerpt.txt:173-186", "provenance/readme_source.txt:42-45"],
          "qualification": "The prose alone does not specify how the time and cell dimensions are combined to compute sigma, how missingness is processed, or which cell cohort was retained."
        },
        {
          "id": "linked_source_definition",
          "statement": "The supplement links swainlab/mi-by-decoding. Its normMeanOffset.m uses B = {o-L-1,...,o-2}, L=20, with one-based origin o. It computes mu = mean_j(mean_i R_ij) and s = mean_j(std_i R_ij), then (R-mu)/s. The standard deviation is the ordinary MATLAB column-wise sample SD, averaged over baseline frames; it is NOT the SD of all pooled cell-time observations. The type argument is unused.",
          "evidence": ["provenance/source_links.json:143-147", "provenance/source_code/normMeanOffset.m:1-10", "provenance/source_code_acquisition.json:6-12"],
          "qualification": "For a complete n-cell cohort, s = (1/L) sum_j sqrt(sum_i (R_ij-mean_i R_ij)^2/(n-1)). Direct mean/std calls do not omit NaNs. The worked example inpaints before normalization. The source code resolves the operator but does not establish the unrecorded export call for every normalized bitstream."
        },
        {
          "id": "baseline_index_offset",
          "statement": "At deposited origin o=49, the normalizer uses columns 28:47. The worked example's rich classification segment instead uses columns 29:48; stress starts at column 49. Under the nominal 2.5-minute grid, the normalizer's frame centres are -52.5 through -5 minutes, whereas the rich segment is -50 through -2.5 minutes.",
          "evidence": ["provenance/source_code/normMeanOffset.m:7-10", "provenance/source_code/example_script.m:64-70", "timing_review.json:1078-1098"],
          "qualification": "These nominal times describe indexing conventions, not recovered acquisition timestamps. Do not silently replace the implemented baseline window with a different 20-frame window."
        },
        {
          "id": "core_prefix_input_not_future_outcome_leakage",
          "statement": "If the complete required pre-stimulus observations and their cohort are explicitly declared available inputs before prediction, a fixed map B -> (mu(B),s(B)) can be test-time initial-state/assay calibration for a post-stimulus conditional response. Use of that known prefix is not in itself access to post-stimulus outcomes.",
          "evidence": ["provenance/source_code/normMeanOffset.m:7-10", "../protocol_review.json:44-47"],
          "qualification": "This is a scientific design option, not the original blind whole-experiment/training-only protocol. Prefix membership, normalization, missingness and invalid-scale handling must be fixed before future-response access. A conditional normalized target is a different target from raw nucLoc and requires an explicit new protocol."
        },
        {
          "id": "full_example_can_depend_on_future_processing",
          "statement": "The linked worked example linearly interpolates each whole trace using all available samples. filterCellsByNucLoc then inpaints the full cell-by-time matrix before normalization, filters using columns o-40:o inclusive, and renormalizes the retained cohort. Since o is the first stress frame in that example, the filter includes that frame. The two-dimensional inpainting solves against known entries across both rows and columns, without a pre-stimulus boundary.",
          "evidence": ["provenance/source_code/example_script.m:39-62,64-70", "provenance/source_code/filterCellsByNucLoc.m:29-64", "provenance/source_code_lf/inpaint_nans.m:125-189"],
          "qualification": "Thus the normalizer's core index set is pre-stimulus, but the full example does not guarantee that its baseline values or selected cohort are functions of a known prefix alone. This is a potential processing dependence, not an assertion that every deposited normalized trace used this exact example pipeline."
        },
        {
          "id": "original_target_and_custody_unchanged",
          "statement": "The original raw nucLoc target, thresholds, exclusions and ineligibility finding remain unchanged. No normalized response has been substituted for raw nucLoc. No prefix or post-stimulus measurement values have been released as learner inputs.",
          "evidence": ["../granados_manifest.json:5-17", "eligibility_audit.json:21-52", "identity_check_plan.json"],
          "qualification": "A source-backed conditional design can be reviewed without claiming that the current files or original strong protocol already satisfy it."
        }
      ]
    },
    {
      "question_id": "normalized_rep2_identity",
      "resolution": "Unresolved: no additional independent Sfp1 experiment is certified from normalized rep2, and no new alias is established by the fixed deterministic checks.",
      "facts": [
        {
          "id": "fixed_source_replays",
          "statement": "Before computation, identity_check_plan.json fixed four representations for all six fig1 replicates against normalized Sfp1/carbon rep1 and rep2: the source normalizer alone or the published worked-example preprocessing, each using deposited nucLoc or the source-defined max5/median ratio. The comparison was the author's origin-20:origin+19 window, retaining whole row sets and row order. Exact double equality and exact %.10g serialized-token equality were specified; no similarity, distance tolerance, arbitrary subsets or offset search was allowed.",
          "evidence": ["identity_check_plan.json", "identity_replay.m:1-90", "provenance/source_code/jsonlab_savejson.m:471-498"],
          "qualification": "The %.10g rule is the linked JSONlab default, not a fitted amplitude threshold. Rounded source exports and incomplete provenance can still prevent deterministic reconstruction of a previous internal representation."
        },
        {
          "id": "replay_result_and_positive_control",
          "statement": "All fixed replay cases completed, but none produced the same complete row-set shape as the target central window, including the known experiment-level alias fig1 rep6 -> normalized fig2 rep1. Numerical equality was therefore not established; false equality fields must not be read as evaluated unequal trajectories when shape compatibility is false.",
          "evidence": ["identity_checks.json:7-500", "identity_checks.json:408-476"],
          "qualification": "Failure on the known alias demonstrates that these source-defined replays are not sensitive identity-exclusion tests for the deposited cohorts. Nonmatch cannot establish biological independence. No response values, normalization constants or error statistics were released."
        },
        {
          "id": "known_alias_has_different_exported_cohorts",
          "statement": "The raw fig1 rep6 and raw fig2 Sfp1/carbon arrays are identical triplets and have 158 rows by 97 frames. Their README-declared normalized rep1 alias has 164 rows by 96 frames. The additional normalized cells cannot be reconstructed by row filtering of this smaller raw export. Normalized rep2 has 155 rows by 96 frames.",
          "evidence": ["overlap_audit.json:125-129", "schema_inventory.json:542-585,2896-2939,5623-5704", "provenance/readme_source.txt:61-83"],
          "qualification": "These are source shapes, not response statistics. Keep the experiment-level rep1 aliases inseparable despite differing exported cell/frame selections; do not assume identical row IDs or a lossless transform between files."
        },
        {
          "id": "rep2_additional_is_local_not_global",
          "statement": "README calls rep2 an additional biological replicate relative to rep1 within the stress-type collection. It does not state that rep2 is absent from all six fig1 experiments. No persistent cell/movie/culture/day crosswalk or the exact normalized-file export call was located.",
          "evidence": ["provenance/readme_source.txt:51-83", "identity_checks.json:497-500", "provenance/source_code/example_script.m:23-70"],